{
  "$schema": "http://json-schema.org/draft-07/schema#",
  "title": "TaskSpec",
  "type": "object",
  "additionalProperties": false,
  "required": ["task_id", "tenant_id", "goal", "context", "constraints"],
  "properties": {
    "task_id": {"type": "string", "minLength": 1},
    "tenant_id": {"type": "string", "minLength": 1},
    "goal": {"type": "string", "minLength": 1},
    "context": {
      "type": "object",
      "additionalProperties": false,
      "properties": {
        "domain": {"type": "string"},
        "data_sources": {"type": "array", "items": {"type": "string"}},
        "target_platform": {"type": "string"}
      }
    },
    "constraints": {
      "type": "object",
      "additionalProperties": false,
      "properties": {
        "env": {"type": "string", "enum": ["dev", "staging", "prod"]},
        "budget": {
          "type": "object",
          "additionalProperties": false,
          "properties": {
            "max_steps": {"type": "integer", "minimum": 1},
            "max_cost_usd": {"type": "number", "minimum": 0}
          }
        },
        "safety_level": {"type": "string", "enum": ["low", "medium", "high"]}
      }
    }
  }
}
